{
  "contractVersion": "0.3",
  "id": "layout-doc-fx-m4-reuse",
  "revision": "ld-m4-reuse-1",
  "facilityRef": { "id": "facility-fx01", "revision": "f-r1" },
  "parentRef": null,
  "elements": [
    {
      "instanceId": "rack-reuse-001",
      "typeElementId": "ST-PAL-01",
      "pose": { "x": 12, "y": 14, "yawDeg": 0 },
      "params": { "levels": 4, "bays": 1, "palletsPerBay": 2, "minClearWidthM": 3.0 },
      "assetDisposition": "existing"
    },
    {
      "instanceId": "dock-recv",
      "typeElementId": "IN-DOCK-01",
      "pose": { "x": 1, "y": 12, "yawDeg": 0 },
      "params": {},
      "assetDisposition": "new"
    },
    {
      "instanceId": "dock-ship",
      "typeElementId": "OUT-DOCK-01",
      "pose": { "x": 39, "y": 12, "yawDeg": 180 },
      "params": {},
      "assetDisposition": "new"
    }
  ],
  "aisles": [
    {
      "id": "aisle-main",
      "centerline": [
        { "x": 2, "y": 12 },
        { "x": 38, "y": 12 }
      ],
      "widthM": 3.5
    }
  ],
  "locks": [],
  "catalogVersion": "catalog-mvp@c-r1"
}
